text;author;book
Jeśli mężczyzna nie używa członka, to on wciąż mu się kurczy, aż wreszcie pewnego dnia chce się odlać i nie może go znaleźć. ;George R.R. Martin;Nawałnica mieczy: Stal i śnieg
Nawet odważni ludzie często wolą być ślepi, gdy boją się coś zobaczyć. ;George R.R. Martin;Nawałnica mieczy: Stal i śnieg
Sadgekins może się wyruchać w dupę gorącym pogrzebaczem. ;George R.R. Martin;Nawałnica mieczy: Krew i złoto
Dajcie mi słodkie kłamstwa i zabierzcie swe gorzkie prawdy. ;George R.R. Martin;Nawałnica mieczy: Krew i złoto
(...) wydawało mu się jednak, że dla umarłych strach nie ma żadnego znaczenia, podobnie jak ból, miłość czy obowiązek. ;George R.R. Martin;Nawałnica mieczy: Stal i śnieg
Bogowie stworzyli ziemię dla wszystkich ludzi. Gdy jednak nadeszli królowie ze swymi koronami i stalowymi mieczami, oznajmili, że cała należy do nich. Mówili: „To moje drzewa. Nie wolno wam jeść tych jabłek. To mój strumień. Nie wolno wam łowić w nim ryb. To mój las. Nie wolno w nim polować. Moja ziemia, moja woda, mój zamek, moja córka, trzymajcie ręce z dala od nich, bo je wam odrąbię, ale jeśli przede mną klękniecie, to może pozwolę wam trochę powąchać”. Nazywacie nas złodziejami, ale złodziej przynajmniej musi być odważny, sprytny i szybki. Klękacz musi tylko klękać. ;George R.R. Martin;Nawałnica mieczy: Stal i śnieg
- Jesteś mój – wyszeptała. – Mój, a ja twoja. Jeśli zginiemy, to trudno. Wszyscy muszą umrzeć, Jonie Snow. Ale najpierw żyjemy. ;George R.R. Martin;Nawałnica mieczy: Stal i śnieg
Jeden król znaczy pokój. ;George R.R. Martin;Nawałnica mieczy: Stal i śnieg
- Nie może mówić - oznajmił mężczyzna w żółtym płaszczu. - Zbyt głęboko poderżnęliście jej gardło, cholerne skurwysyny. Ale pamięta. ;George R.R. Martin;Nawałnica mieczy: Krew i złoto
Życie jest ciepłem, ciepło jest ogniem, a ogień jest tylko u Boga. ;George R.R. Martin;Nawałnica mieczy: Stal i śnieg
"- Byłem od ciebie lepszy, ser Lorasie. Wyższy, silniejszy i szybszy.
- Ale teraz jesteś starszy - odparł chłopak. - Panie.
Jaime nie potrafił powstrzymać śmiechu. To niedorzeczne. Tyrion wyśmiałby mnie bezlitośnie, gdyby zobaczył, jak spieram się z zielonym gołowąsem, który z nas ma dłuższego kutasa. ";George R.R. Martin;Nawałnica mieczy: Krew i złoto
Mogę walczyć z wami po kolei albo ze wszystkimi razem. ;George R.R. Martin;Nawałnica mieczy: Krew i złoto
Najwięksi głupcy często okazują się mądrzejsi od tych, którzy się z nich śmieją... ;George R.R. Martin;Nawałnica mieczy: Stal i śnieg
Nadal nie była w stanie na niego spojrzeć. Gdyby to zrobiła, mogłaby go znowu spoliczkować. Albo się rozpłakać. Albo go pocałować. Nie wiedząc, co jest słuszne, co jest błędem, a co szaleństwem. ;George R.R. Martin;Nawałnica mieczy: Stal i śnieg
Stoczymy bitwę, a potem odpoczniemy. Żywi albo martwi, odpoczniemy. ;George R.R. Martin;Nawałnica mieczy: Krew i złoto
"Pyp, pomóż mi dojść do klatki. Grenn, Mur należy do ciebie.
- Do mnie? - zapytał Grenn.
- Do niego? - zawołał Pyp.
Trudno było określi, który z nich jest bardziej przerażony. ";George R.R. Martin;Nawałnica mieczy: Krew i złoto
Jaime uśmiechnął się znacząco. Ludzie potrafili wyczytać z takiego uśmiechu najrozmaitsze rzeczy, jeśli im na to pozwolić. ;George R.R. Martin;Nawałnica mieczy: Stal i śnieg
Wszyscy muszą umrzeć. ;George R.R. Martin;Nawałnica mieczy: Krew i złoto
"- Jestem winny - rzekł. - Tak bardzo winny. Czy to właśnie chcieliście usłyszeć? (...)
- Przyznajesz, że otrułeś króla?
- Nic w tym rodzaju - zaprzeczył Tyrion. - Śmierci Joffreya nie jestem winien. Dopuściłem się bardziej monstrualnej zbrodni. - Postąpił krok w stronę ojca. - Urodziłem się. Żyję. Przyznaję, że jestem winny bycia karłem. I bez względu na to, jak często mój łaskawy ojciec mi wybaczał, uporczywie trwałem w swej hańbie. ";George R.R. Martin;Nawałnica mieczy: Krew i złoto
"- Jestem winny - rzekł. - Tak bardzo winny. Czy to właśnie chcieliście usłyszeć? (...)
- Przyznajesz, że otrułeś króla?
- Nic w tym rodzaju - zaprzeczył Tyrion. - Śmierci Joffreya nie jestem winien. Dopuściłem się bardziej monstrualnej zbrodni. - Postąpił krok w stronę ojca. - Urodziłem się. Żyję. Przyznaję, że jestem winny bycia karłem. I bez względu na to, jak często mój łaskawy ojciec mi wybaczał, uporczywie trwałem w swej hańbie. ";George R.R. Martin;Nawałnica mieczy: Krew i złoto
"(...)
- Znam tę opowieść - stwierdził Tyrion. - I co z niej wynika?
- To, że gdybym kiedyś znalazł obok łoża szarfę i pociągnął za nią, wolałbym, żeby spadły na mnie skorpiony niż królowa w całej swej nagiej krasie. ";George R.R. Martin;Nawałnica mieczy: Krew i złoto
"Schodzę do Królewskiej Wieży - oznajmił. - Zawołajcie mnie, jeśli Mance wymyśli coś nowego. Pyp, Mur należy do ciebie.
- Do mnie? - zdziwił się Pyp.
- Do niego? - powtórzył pytanie Grenn.
Jon oddalił się z uśmiechem na ustach i zjechał na dół klatką. ";George R.R. Martin;Nawałnica mieczy: Krew i złoto
Czemu nie zostawią mnie w spokoju? Chcę odpocząć, to wszystko, odpocząć i trochę się przespać, a może trochę umrzeć. ;George R.R. Martin;Nawałnica mieczy: Stal i śnieg
Jeden głos może kłamać, ale w wielu zawsze można odnaleźć prawdę. ;George R.R. Martin;Nawałnica mieczy: Stal i śnieg
Zapamiętajcie pieśń moją, bo gdy mnie już nie będzie wszystkie pieśni umilkną na wieki. ;George R.R. Martin;Nawałnica mieczy: Krew i złoto
Pies zginie dla ciebie, ale nigdy cię nie okłamie. ;George R.R. Martin;Nawałnica mieczy: Krew i złoto
"- Rzecz jasna nie można też zapomnieć o propozycji lorda Karstarka, który zaoferował rękę swojej córki człowiekowi, który przyniesie mu twoją głowę.
- A twój kozioł oczywiście zrozumiał to na odwrót. ";George R.R. Martin;Nawałnica mieczy: Stal i śnieg
Półprawdy są więcej warte od kłamstw. ;George R.R. Martin;Nawałnica mieczy: Krew i złoto
- Wszyscy muszą umrzeć - słyszał niemal jej głos. - Mężczyźni, kobiety i wszystkie zwierzęta, które latają w powietrzu, pływają w wodzie albo chodzą po ziemi. Nie chodzi o to, kiedy umrzemy, Jonie Snow. Ważne tylko, jak to się stanie. ;George R.R. Martin;Nawałnica mieczy: Krew i złoto
